{
  "schema_version": "trainomni.sample.v0.1",
  "id": "cpt-000001",
  "objective": "cpt",
  "assets": [
    {
      "id": "figure-1",
      "modality": "image",
      "uri": "figures/000001.png",
      "width": 640,
      "height": 480
    }
  ],
  "messages": [
    {
      "role": "document",
      "content": [
        {"type": "text", "text": "Figure 1 shows the result. "},
        {"type": "media", "asset_id": "figure-1"},
        {"type": "text", "text": "The blue line increases over time."}
      ]
    }
  ],
  "metadata": {
    "source": "m0-fixture",
    "split": "train",
    "license": "test-only"
  }
}

