{
  "schema_version": "trainomni.sample.v0.1",
  "id": "pref-000001",
  "objective": "preference",
  "assets": [
    {
      "id": "photo",
      "modality": "image",
      "uri": "images/animal.jpg"
    }
  ],
  "messages": [
    {
      "role": "user",
      "content": [
        {"type": "media", "asset_id": "photo"},
        {"type": "text", "text": "图里是什么动物？"}
      ]
    }
  ],
  "preference": {
    "chosen": {
      "messages": [
        {
          "role": "assistant",
          "content": [{"type": "text", "text": "一只橘猫。"}]
        }
      ]
    },
    "rejected": {
      "messages": [
        {
          "role": "assistant",
          "content": [{"type": "text", "text": "一只小狗。"}]
        }
      ]
    },
    "judge": "human"
  }
}

